Verb,VerbMeaning,A1,A1Sem,A2,A2Sem,A3,A3Sem,A4,A4Sem,A5,A5Sem,Meaning
глушить,3.1,NO_Nom,человек,NO_Acc,живое существо,NO_Ins,предмет-часть тела,-,-,-,-,"А1 глушит А2 с помощью А3 ‘Человек А1 с силой ударяет предметом или частью тела А3 живое существо А2 по голове или использует средство А3 так, что А2 теряет сознание или умирает’."
глушить,3.2,NO_Nom,человек,NO_Acc,человек,NO_Ins,средство,-,-,-,-,"А1 глушит А2 ‘Человек А1 воздействует на человека А2 сильнодействующими средствами А3 в большом количестве, так что его сознание перестает полноценно функ ционировать’ [А1 и А2 могут совпадать]"
глушить,4.1,NO_Nom,человек,NO_Acc,состояние,NO_Ins,объект,-,-,-,-,"А1 глушит А2 с помощью А3 ‘Человек А1, желая прекратить нежелательное для себя эмоциональное или физическое состояние А2, использует А3, в результате чего А2 становится менее интенсивным или перестает существовать’."
глушить,4.2,NO_Nom,фактор,NO_Acc,состояние-способность,-,-,-,-,-,-,"А1 глушит А2 ‘Воздействие фактора А1 приво дит к тому, что эмоциональное, ментальное или физическое состояние или способность А2 человека А1 становятся менее интенсивными или перестают существовать’."
глушить,4.3,NO_Nom,лицо,NO_Acc,человек,-,-,-,-,-,-,‘Лицо А1 делает что-то по отношению к человеку А2 с целью ограничить свободу действий А2’ [А1 может совпадать с А2]
глушить,4.4,NO_Nom,растение,NO_Acc,растение,-,-,-,-,-,-,"‘Растение А1 мешает растению А2 нормально развиваться, находясь слишком близко от него и тем самым создавая для А2 недостаток света, места или влаги’."
глушить,5,-,-,NO_Acc,устройство,-,-,-,-,-,-,‘Переводить устройство А2 из рабочего состоя ния в нерабочее’.
глушить,6,-,-,NO_Acc,алкоголь,-,-,-,-,-,-,"‘Пить алкогольные напитки А2 в большом коли честве, часто большими порциями’."
воскресать,1,NO_Nom,существо,-,-,-,-,-,-,-,-,"А1 воскрес ‘Существо А1, которое было мерт вым, стало живым в результате Божественного замысла или в результате действия Бога или существа, наделенного особыми возможностями’ [обычно о людях или Боге в образе человека]"
воскресать,2.1,NO_Nom,человек,-,-,-,-,-,-,-,-,"А1 воскрес ‘Человек А1, который был в очень плохом физическом или психологическом состоянии, вернулся в нормальное состояние’ [по аналогии - о животных и растениях]"
воскресать,2.2,NO_Nom,объект,из_Gen,плохое состояние,-,-,-,-,-,-,"А1 воскрес ‘Объект А1, который был в очень плохом состоянии А2, был разрушен или не функционировал, снова начал нормально существовать или функционировать’"
воскресать,3,NO_Nom,явление,-,-,-,-,-,-,-,-,"А1 воскрес ‘Явление А1, которое исчезло, опять возникло’ [часто о явлениях внутреннего мира человека - чувствах, воспоминаниях, мыслях]"
ворочать,1,NO_Nom,человек-животное,NO_Acc,объект,NO_Ins,инструмент-руки-лапы,-,-,-,-,"А1 ворочает А2 с помощью A3 ‘Человек или животное А1 перемещают или двигают тяжелый объект А2, обыч но переворачивая его руками, лапами или инструментом А3’"
ворочать,2.1,NO_Nom,человек,NO_Ins,инструмент,-,-,-,-,-,-,"‘Человек А1 с усилием работает инструментом А2, поворачивая его, преодолевая сопротивление среды, в которой инструмент двигается’."
ворочать,2.2,NO_Nom,человек-животное,NO_Ins,орган-часть тела,-,-,-,-,-,-,"А1 ворочает А2 ‘Человек или животное А1 с усилием двигает органом или частью тела А2 из-за тревоги, усталости или болезни, как бы преодолевая сопротивление’"
ворочать,2.3,NO_Nom,лицо,NO_Ins,деятельность,-,-,-,-,-,-,"‘Лицо А1 управляет деятельностью А2 или деятельностью, связанной с объектом А2, что требует от него очень больших усилий’."
вынуждать,1,NO_Nom,человек,NO_Acc,человек,к_Dat,действие,NO_Ins,средство,-,-,"А1 вынудил А2 сделать A3 ‘Человек А1, сделав А4, добился этим того, что человек А2, который не хотел или которому было неприятно делать А3, не мог не сделать А3’ [по аналогии - о животных в роли А1 или А2]."
вынуждать,1,NO_Nom,человек,NO_Acc,человек,у_Gen,действие,NO_Ins,средство,-,-,"А1 вынудил А2 сделать A3 ‘Человек А1, сделав А4, добился этим того, что человек А2, который не хотел или которому было неприятно делать А3, не мог не сделать А3’ [по аналогии - о животных в роли А1 или А2]."
вынуждать,2,NO_Nom,ситуация-явление,NO_Acc,лицо,к_Dat,действие,-,-,-,-,"А1 вынудил А2 сделать A3 ‘Ситуация или явление А1 было причиной того, что лицо А2, которое не намеревалось делать А3, не могло этого не сделать’."
действовать,1.1,NO_Nom,человек,NO_Ins,инструмент,-,-,-,-,-,-,"‘Делая что-л. для достижения своей цели, двигать инструмент A2, обычно держа его в руке, или часть своего тела A2’"
действовать,2.1,NO_Nom,устройство-часть тела,-,-,-,-,-,-,-,-,"‘Выполнять свои функции’ [об устройствах и частях тела]."   
действовать,2.2,NO_Nom,объект,на_Loc,место,-,-,-,-,-,-,"‘Существуя длительное время в месте A2, объект A1 занимается присущей ему деятельностью’ [об организациях или группах людей]."
действовать,2.2,NO_Nom,объект,в_Loc,место,-,-,-,-,-,-,"‘Существуя длительное время в месте A2, объект A1 занимается присущей ему деятельностью’ [об организациях или группах людей]."
действовать,2.3,-,-,в_Loc,произведение,-,-,-,-,-,-,"‘Быть персонажем художественного произведения A2’ [обычно о литературе, театре и кино]"
действовать,3,NO_Nom,объект,с_Gen,время,-,-,-,-,-,-,"A1 действует в период A2: ‘Объект A1 официально признается выполняющим свое предназначение во время A2 или до момента A2, утрачивая это свойство в другое время’ [A1 - документ, закон и т. п.]"
действовать,3,NO_Nom,объект,до_Gen,время,-,-,-,-,-,-,"A1 действует в период A2: ‘Объект A1 официально признается выполняющим свое предназначение во время A2 или до момента A2, утрачивая это свойство в другое время’ [A1 - документ, закон и т. п.]"
действовать,3,NO_Nom,объект,по_Acc,время,-,-,-,-,-,-,"A1 действует в период A2: ‘Объект A1 официально признается выполняющим свое предназначение во время A2 или до момента A2, утрачивая это свойство в другое время’ [A1 - документ, закон и т. п.]"
действовать,3,NO_Nom,объект,в течение_Gen,время,-,-,-,-,-,-,"A1 действует в период A2: ‘Объект A1 официально признается выполняющим свое предназначение во время A2 или до момента A2, утрачивая это свойство в другое время’ [A1 - документ, закон и т. п.]"
действовать,3,NO_Nom,объект,NO_Acc,время,-,-,-,-,-,-,"A1 действует в период A2: ‘Объект A1 официально признается выполняющим свое предназначение во время A2 или до момента A2, утрачивая это свойство в другое время’ [A1 - документ, закон и т. п.]"
действовать,4,NO_Nom,фактор-объект,на_Acc,объект,-,-,-,-,-,-,"A1 действует на A2 ‘Фактор или объект A1 является причиной изменений A3 в объекте A2’"
возглавлять,1,NO_Nom,человек,NO_Acc,группа людей-деятельность,-,-,-,-,-,-,"А1 возглавляет А2 ‘Человек А1 руководит группой людей А2 или деятельностью А2’."
возглавлять,2,NO_Nom,объект,NO_Acc,группа однородных объектов,-,-,-,-,-,-,"‘Располагаться в начале группы однородных объектов А2, что обычно связано с относительной важностью"
завершать,1.1,NO_Nom,человек,NO_Acc,сооружение,NO_Ins,элемент,-,-,-,-,"А1 завершил сооружение А2 элементомА3 ‘Человек А1, создавая сооружение А2, расположил на его верху элемент А3 в качестве части А2, существенной для его функционирования или внешнего вида’."
завершать,1.2,NO_Nom,элемент,NO_Acc,сооружение,-,-,-,-,-,-,"А1 завершает сооружение А2 ‘Элемент А1 сооружения А2 является верхней частью А2, существенной для его внешнего вида и целостности сооружения’."
завершать,2.1,NO_Nom,человек,NO_Acc,действие-деятельность,-,-,-,-,-,-,"А1 завершил А2 ‘Человек А1 перестал осуществлять действие или деятельность А2 или работать над созданием объекта А2, так как цель была достигнута’."
завершать,2.2,NO_Nom,человек,NO_Acc,действие-деятельность,NO_Ins,элемент,-,-,-,-,"А1 завершил А2 элементом А3 ‘Человек А1 перестал осуществлять действие или деятельность А2 или создавать объект А2, и последним элементом А2 было действие А3, существенное для А2’"
завершать,2.3,NO_Nom,часть произведения,NO_Acc,произведение,-,-,-,-,-,-,"А1 завершает А2 ‘Часть А1 произведения А2 является последним элементом А2, существенным для общего смысла А2’"